{
  "$schema": "https://json-schema.org/draft/2020-12/schema",
  "$id": "https://cannery-row.invalid/schemas/0.2/evaluator_config.schema.json",
  "title": "Stock evaluator configuration",
  "description": "The versioned policy of the stock evaluator (`cannery evaluator`): declarative gates and the baseline values they compare against. Its `evaluator.revision` is the revision registered in the science revision, which every verdict reports as its policy revision. Cannery Row never reads this file; the evaluator does.",
  "type": "object",
  "properties": {
    "schema_version": {"$ref": "common.schema.json#/$defs/schema_version"},
    "evaluator": {
      "description": "The evaluator service account name and this policy's revision.",
      "type": "object",
      "properties": {
        "id": {"$ref": "common.schema.json#/$defs/identifier"},
        "revision": {"$ref": "common.schema.json#/$defs/identifier"}
      },
      "required": ["id", "revision"],
      "additionalProperties": false
    },
    "gates": {
      "type": "array",
      "minItems": 1,
      "items": {"$ref": "gates.schema.json#/$defs/gate"}
    },
    "baselines": {
      "description": "Values of baselines, by id and revision. A gate compares against the value of the attempt's control for the gate's metric, split and slice. At most one value per baseline, metric, split and slice.",
      "type": "array",
      "items": {
        "type": "object",
        "properties": {
          "id": {"$ref": "common.schema.json#/$defs/slug"},
          "revision": {"$ref": "common.schema.json#/$defs/identifier"},
          "label": {
            "description": "How comparisons name this baseline; defaults to `<id> <revision>`.",
            "$ref": "common.schema.json#/$defs/text"
          },
          "measurements": {
            "type": "array",
            "items": {"$ref": "#/$defs/baseline_measurement"}
          }
        },
        "required": ["id", "revision", "measurements"],
        "additionalProperties": false
      }
    },
    "default_control": {
      "description": "The control used when the hypothesis names none.",
      "$ref": "common.schema.json#/$defs/pinned_ref"
    }
  },
  "required": ["schema_version", "evaluator", "gates", "baselines"],
  "additionalProperties": false,
  "$defs": {
    "baseline_measurement": {
      "description": "One value of a baseline: a metric on a split, overall (no dimensions) or on a single-dimension slice.",
      "type": "object",
      "properties": {
        "metric": {"$ref": "common.schema.json#/$defs/name"},
        "split": {"$ref": "common.schema.json#/$defs/slug"},
        "dimensions": {
          "allOf": [{"$ref": "common.schema.json#/$defs/dimensions"}],
          "maxProperties": 1
        },
        "value": {"type": "number"},
        "uncertainty": {
          "type": "object",
          "properties": {
            "method": {"$ref": "common.schema.json#/$defs/text"},
            "lower": {"type": "number"},
            "upper": {"type": "number"}
          },
          "required": ["method", "lower", "upper"],
          "additionalProperties": false
        }
      },
      "required": ["metric", "split", "dimensions", "value"],
      "additionalProperties": false
    }
  }
}
