{
  "schema_version": "0.2",
  "evaluator": {"id": "stock-evaluator", "revision": "policy-r1"},
  "gates": [
    {"id": "primary-beats-control", "metric": "ndcg_at_10", "split": "fresh-held-out", "statistic": "uncertainty.lower", "compare": "control", "op": ">", "min_delta": 0.0},
    {"id": "no-language-regression", "metric": "ndcg_at_10", "split": "fresh-held-out", "per_dimension": "language", "statistic": "value", "compare": "control", "op": ">=", "min_delta": -0.01}
  ],
  "baselines": [
    {
      "id": "base-camp",
      "revision": "base-camp-r1",
      "label": "Base camp (r1)",
      "measurements": [
        {"metric": "ndcg_at_10", "split": "fresh-held-out", "dimensions": {}, "value": 0.40, "uncertainty": {"method": "cluster-bootstrap", "lower": 0.38, "upper": 0.42}},
        {"metric": "ndcg_at_10", "split": "fresh-held-out", "dimensions": {"language": "fr"}, "value": 0.38},
        {"metric": "ndcg_at_10", "split": "fresh-held-out", "dimensions": {"language": "en"}, "value": 0.42}
      ]
    }
  ],
  "default_control": {"id": "base-camp", "revision": "base-camp-r1"}
}
